<?xml version="1.0" encoding="utf-8" ?>
<language xmlns:xs="http://www.w3.org/2001/XMLSchema-instance"
    xs:noNamespaceSchemaLocation="http://www.csphere.eu/xml/schemas/language.xsd">
    <translation type="plugin" name="debug" version_min="0.1" short="en" />
    <vendor>csphere</vendor>
    <version>0.1</version>
    <published>2012-03-01</published>
    <copyright>cSphere Team</copyright>
    <license>Simplified BSD License</license>
    <name>Debug</name>
    <info>Contains debug tools and information</info>
    <engine name="csphere" version_min="2013.0" />
    <icon type="famfamfam">gb</icon>
    <authors>
        <current>cSphere Team</current>
        <past>cSphere Team</past>
    </authors>
    <contact>
        <email adress="contact@csphere.eu" />
        <web url="http://www.csphere.eu" />
    </contact>
    <definitions>
        <define name="backtrace">Backtrace</define>
        <define name="call">Call</define>
        <define name="code">Code</define>
        <define name="component">Component</define>
        <define name="database">Database</define>
        <define name="debug">Debug</define>
        <define name="errors">Errors</define>
        <define name="file">File</define>
        <define name="includes">Includes</define>
        <define name="line">Line</define>
        <define name="logs">Logs</define>
        <define name="memory">Memory</define>
        <define name="message">Message</define>
        <define name="ms">ms</define>
        <define name="parsetime">Parsetime</define>
        <define name="step">Step</define>
    </definitions>
</language>