<?xml version="1.0" encoding="utf-8" ?>
<language xmlns:xs="http://www.w3.org/2001/XMLSchema-instance"
    xs:noNamespaceSchemaLocation="http://www.csphere.eu/xml/schemas/language.xsd">
    <translation type="plugin" name="cache" version_min="0.1" short="en" />
    <vendor>csphere</vendor>
    <version>0.1</version>
    <published>2012-03-01</published>
    <copyright>cSphere Team</copyright>
    <license>Simplified BSD License</license>
    <name>Cache</name>
    <info>Stores prepared data</info>
    <engine name="csphere" version_min="2013.0" />
    <icon type="famfamfam">gb</icon>
    <authors>
        <current>cSphere Team</current>
        <past>cSphere Team</past>
    </authors>
    <contact>
        <email adress="contact@csphere.eu" />
        <web url="http://www.csphere.eu" />
    </contact>
    <definitions>
        <define name="cache">Cache</define>
        <define name="count">Count</define>
        <define name="clear">Clear cache</define>
        <define name="clear_ok">Cache cleared with success</define>
        <define name="control">Control</define>
        <define name="driver">Driver</define>
        <define name="key">Key</define>
        <define name="no_entry">No entry found</define>
        <define name="size">Size</define>
        <define name="time">Time</define>
    </definitions>
</language>