<?xml version="1.0" encoding="utf-8" ?>
<language xmlns:xs="http://www.w3.org/2001/XMLSchema-instance"
    xs:noNamespaceSchemaLocation="http://www.csphere.eu/xml/schemas/language.xsd">
    <translation type="plugin" name="languages" version_min="0.1" short="en" />
    <vendor>csphere</vendor>
    <version>0.1</version>
    <published>2012-03-01</published>
    <copyright>cSphere Team</copyright>
    <license>Simplified BSD License</license>
    <name>Languages</name>
    <info>Translation tools and details</info>
    <engine name="csphere" version_min="2013.0" />
    <icon type="famfamfam">gb</icon>
    <authors>
        <current>cSphere Team</current>
        <past>cSphere Team</past>
    </authors>
    <contact>
        <email adress="contact@csphere.eu" />
        <web url="http://www.csphere.eu" />
    </contact>
    <definitions>
        <define name="duplication">Duplication</define>
        <define name="language">Language</define>
        <define name="languages">Languages</define>
        <define name="short">Short</define>
        <define name="translated">Translation</define>
        <define name="warn_missing">Missing keys</define>
        <define name="warn_noname">Name must be translated</define>
        <define name="warn_difference">Different keys</define>
        <define name="warn_override">Definition of default plugin overriden</define>
    </definitions>
</language>