<?xml version="1.0" encoding="utf-8" ?>
<language xmlns:xs="http://www.w3.org/2001/XMLSchema-instance"
    xs:noNamespaceSchemaLocation="http://www.csphere.eu/xml/schemas/language.xsd">
    <translation type="plugin" name="contact" version_min="0.1" short="de" />
    <vendor>csphere</vendor>
    <version>0.1</version>
    <published>2012-03-01</published>
    <copyright>cSphere Team</copyright>
    <license>Simplified BSD License</license>
    <name>Contact</name>
    <info>Stellt ein Kontaktvormular bereit</info>
    <engine name="csphere" version_min="2013.0" />
    <icon type="famfamfam">de</icon>
    <authors>
        <current>cSphere Team</current>
        <past>cSphere Team</past>
    </authors>
    <contact>
        <email adress="contact@csphere.eu" />
        <web url="http://www.csphere.eu" />
    </contact>
    <definitions>
        <define name="contact">Kontakt</define>
        <define name="subject">Betreff</define>
        <define name="message">Nachricht</define>
        <define name="answer">Antwort</define>
    </definitions>
</language>