<?xml version="1.0" encoding="utf-8" ?>
<language xmlns:xs="http://www.w3.org/2001/XMLSchema-instance"
    xs:noNamespaceSchemaLocation="http://www.csphere.eu/xml/schemas/language.xsd">
    <translation type="plugin" name="debug" version_min="0.1" short="de" />
    <vendor>csphere</vendor>
    <version>0.1</version>
    <published>2012-03-01</published>
    <copyright>cSphere Team</copyright>
    <license>Simplified BSD License</license>
    <name>Debug</name>
    <info>Enth√§lt Debug-Werkzeuge und Informationen</info>
    <engine name="csphere" version_min="2013.0" />
    <icon type="famfamfam">de</icon>
    <authors>
        <current>cSphere Team</current>
        <past>cSphere Team</past>
    </authors>
    <contact>
        <email adress="contact@csphere.eu" />
        <web url="http://www.csphere.eu" />
    </contact>
    <definitions>
        <define name="backtrace">Ablaufverfolgung</define>
        <define name="call">Aufruf</define>
        <define name="code">Code</define>
        <define name="component">Komponente</define>
        <define name="database">Datenbank</define>
        <define name="debug">Debug</define>
        <define name="errors">Fehler</define>
        <define name="file">Datei</define>
        <define name="includes">Includes</define>
        <define name="line">Zeile</define>
        <define name="logs">Logs</define>
        <define name="memory">Speicher</define>
        <define name="message">Meldung</define>
        <define name="ms">ms</define>
        <define name="parsetime">Ladezeit</define>
        <define name="step">Schritt</define>
    </definitions>
</language>