<?xml version="1.0" encoding="utf-8" ?>
<language xmlns:xs="http://www.w3.org/2001/XMLSchema-instance"
    xs:noNamespaceSchemaLocation="http://www.csphere.eu/xml/schemas/language.xsd">
    <translation type="plugin" name="install" version_min="0.1" short="de" />
    <vendor>csphere</vendor>
    <version>0.1</version>
    <published>2012-03-01</published>
    <copyright>cSphere Team</copyright>
    <license>Simplified BSD License</license>
    <name>Installation</name>
    <info>Bietet eine Führung durch die Installation</info>
    <engine name="csphere" version_min="2013.0" />
    <icon type="famfamfam">de</icon>
    <authors>
        <current>cSphere Team</current>
        <past>cSphere Team</past>
    </authors>
    <contact>
        <email adress="contact@csphere.eu" />
        <web url="http://www.csphere.eu" />
    </contact>
    <definitions>
        <define name="admin_ok">Administrator erfolgreich gespeichert</define>
        <define name="ajax_full">Erweitertes AJAX</define>
        <define name="ajax_info">Der Hauptinhalt wird damit unabhängig vom Rest der Seite erneuert</define>
        <define name="cache_info">None ist nur für Entwickler gedacht. File nur verwenden, wenn sonst nichts verfügbar ist.</define>
        <define name="cache_ok">Die Datenspeicher-Einstellungen sind korrekt</define>
        <define name="cache_type">Zwischenspeicher</define>
        <define name="conf">Konfiguration</define>
        <define name="config_ok">Konfiguration erfolgreich erstellt</define>
        <define name="db">Datenbank</define>
        <define name="database_ok">Die Datenbank-Einstellungen sind korrekt</define>
        <define name="db_file">Dateiname</define>
        <define name="db_file_info">Pflicht bei SQLite, optional bei LocalDB, ohne Pfadangabe</define>
        <define name="db_prefix">Prefix</define>
        <define name="db_prefix_info">Steht Datenbanktabellennamen voran, nur Buchstaben</define>
        <define name="db_schema">Schema</define>
        <define name="db_schema_info">Name der Datenbank auf dem angegebenen Server</define>
        <define name="debug_mode">Debug Modus</define>
        <define name="debug_info">Aktiviert zusätzliche Anzeigen für Entwickler</define>
        <define name="error_logs">Fehlerlogs anlegen</define>
        <define name="host_info">Valide IP oder DNS, z.B. localhost oder 127.0.0.1</define>
        <define name="install">Installation</define>
        <define name="lang">Sprache</define>
        <define name="language_ok">Die folgende Seite ist wie gewünscht übersetzt</define>
        <define name="logs_info">Speichere auftretende Fehler zur späteren Ansicht</define>
        <define name="mail">E-Mail</define>
        <define name="mail_newline">Zeilenumbruch</define>
        <define name="mail_newline_info">Default verwenden, solange der Dienst keine Abweichung benötigt</define>
        <define name="mail_ok">E-Mail-Einstellungen erfolgreich gespeichert</define>
        <define name="mail_subject">Titel</define>
        <define name="mail_subject_info">Dieser Text steht allen Titeln voran</define>
        <define name="mail_test_fail">Mit den gegebenen Einstellungen ist kein Versand möglich</define>
        <define name="mail_test_subject">Testmail</define>
        <define name="mail_test_text">Das Betrachten dieser Nachricht bedeutet, dass der E-Mailversand klappt.</define>
        <define name="memory">Datenspeicher</define>
        <define name="no_cache">Die Cache-Einstellungen sind fehlerhaft</define>
        <define name="no_cfg">Das Verzeichnis /csphere/config muss beschreibbar sein</define>
        <define name="no_db">Fehler in der Datenbankkonfiguration</define>
        <define name="no_php_ext">Required PHP extensions not loaded</define>
        <define name="port_info">Port, auf dem der Service läuft</define>
        <define name="pretty_urls">Hübsche URLs</define>
        <define name="rewrite_info">Achtung: Benötigt Webserver-spezifische Regeln, siehe Dokumentation</define>
        <define name="server">Servertyp</define>
        <define name="test">Test</define>
        <define name="timeout">Timeout</define>
        <define name="timeout_info">Timeout in Sekunden</define>
        <define name="too_short">Benutzername und Passwort müssen mindestens vier Zeichen lang sein</define>
        <define name="webmaster">Seitenverwalter</define>
        <define name="welcome">Willkommen</define>
        <define name="welcome_info">Dies installiert das cSphere CMS, zum Fortfahren unten klicken</define>
        <define name="zlib_compression">ZLIB Komprimierung</define>
        <define name="zlib_info">Komprimiert HTTP-Antworten mit gzip, empfohlen</define>
    </definitions>
</language>