<?xml version="1.0" encoding="utf-8" ?>
<language xmlns:xs="http://www.w3.org/2001/XMLSchema-instance"
    xs:noNamespaceSchemaLocation="http://www.csphere.eu/xml/schemas/language.xsd">
    <translation type="plugin" name="plugins" version_min="0.1" short="de" />
    <vendor>csphere</vendor>
    <version>0.1</version>
    <published>2012-03-01</published>
    <copyright>cSphere Team</copyright>
    <license>Simplified BSD License</license>
    <name>Plugins</name>
    <info>Verwaltet installierte Erweiterungen</info>
    <engine name="csphere" version_min="2013.0" />
    <icon type="famfamfam">de</icon>
    <authors>
        <current>cSphere Team</current>
        <past>cSphere Team</past>
    </authors>
    <contact>
        <email adress="contact@csphere.eu" />
        <web url="http://www.csphere.eu" />
    </contact>
    <definitions>
        <define name="delete">Entfernen</define>
        <define name="manual_install">Manuell Installieren</define>
        <define name="php_extensions">Ben√∂tigte PHP Erweiterungen</define>
        <define name="plugin_market">Plugin Markt</define>
        <define name="plugins">Plugins</define>
    </definitions>
</language>