<?xml version="1.0" encoding="utf-8" ?>
<language xmlns:xs="http://www.w3.org/2001/XMLSchema-instance"
    xs:noNamespaceSchemaLocation="http://www.csphere.eu/xml/schemas/language.xsd">
    <translation type="plugin" name="languages" version_min="0.1" short="de" />
    <vendor>csphere</vendor>
    <version>0.1</version>
    <published>2012-03-01</published>
    <copyright>cSphere Team</copyright>
    <license>Simplified BSD License</license>
    <name>Languages</name>
    <info>Translation tools and details</info>
    <engine name="csphere" version_min="2013.0" />
    <icon type="famfamfam">de</icon>
    <authors>
        <current>cSphere Team</current>
        <past>cSphere Team</past>
    </authors>
    <contact>
        <email adress="contact@csphere.eu" />
        <web url="http://www.csphere.eu" />
    </contact>
    <definitions>
        <define name="action">Aktion</define>
        <define name="admin">Administration</define>
        <define name="authors_current">Derzeitige Autoren</define>
        <define name="authors_past">Vorherige Autoren</define>
        <define name="contact_email">E-Mail</define>
        <define name="contact_web">Webseite</define>
        <define name="contains_designs">Beinhaltet das Aussehen für</define>
        <define name="copyright">Copyright</define>
        <define name="details">Details</define>
        <define name="engine">Engine</define>
        <define name="icon">Icon</define>
        <define name="info">Info</define>
        <define name="install">Installation</define>
        <define name="language">Sprache</define>
        <define name="languages">Sprachen</define>
        <define name="layout">Layout</define>
        <define name="license">Lizenz</define>
        <define name="short">Kurz</define>
        <define name="plugin">Plugin</define>
        <define name="plugins">Plugins</define>
        <define name="published">Veröffentlich am</define>
        <define name="theme">Theme</define>
        <define name="themes">Themes</define>
        <define name="translated">Übersetzung</define>
        <define name="until">bis</define>
        <define name="vendor">Hersteller</define>
        <define name="version">Version</define>
        <define name="warn_noname">Der Name muss übersetzt sein</define>
        <define name="warn_difference">Unterschied zu anderer Hauptsprache</define>
        <define name="warn_override">Definition des Plugins default überschrieben</define>
    </definitions>
</language>