<?xml version="1.0" encoding="utf-8" ?>
<language xmlns:xs="http://www.w3.org/2001/XMLSchema-instance"
          xs:noNamespaceSchemaLocation="http://www.csphere.eu/xml/schemas/language.xsd">
    <translation type="plugin" name="staticpages" version_min="0.1" short="de"/>
    <vendor>csphere</vendor>
    <version>0.1</version>
    <published>2014-01-08</published>
    <copyright>cSphere Team</copyright>
    <license>Simplified BSD License</license>
    <name>Statische Seiten</name>
    <info>Verwalte und betrachte statische Seiten</info>
    <engine name="csphere" version_min="2013.0"/>
    <icon type="famfamfam">de</icon>
    <authors>
        <current>cSphere Team</current>
        <past>cSphere Team</past>
    </authors>
    <contact>
        <email adress="contact@csphere.eu"/>
        <web url="http://www.csphere.eu"/>
    </contact>
    <definitions>
        <define name="content">Inhalt</define>
        <define name="error403_description">Der Zugriff zu dieser Seite wurde verweigert. Sollten Sie dies für einen Fehler halten, wenden Sie sich bitte an den Administrator.</define>
        <define name="error403_title">Zugriff verweigert</define>
        <define name="publish">Veröffentlichen</define>
        <define name="published">Veröffentlicht</define>
        <define name="sites">Seiten</define>
        <define name="show_layout">Seitenlayout anzeigen</define>
        <define name="title">Titel</define>
        <define name="title_length_list">Titellänge (Liste)</define>
        <define name="title_length_manage">Titellänge (Verwaltung)</define>
        <define name="title_or_tags">Titel oder Schlagwörter</define>
    </definitions>
</language>
