<?xml version="1.0" encoding="utf-8" ?>
<language xmlns:xs="http://www.w3.org/2001/XMLSchema-instance"
    xs:noNamespaceSchemaLocation="http://www.csphere.eu/xml/schemas/language.xsd">
    <translation type="plugin" name="database" version_min="0.1" short="en" />
    <vendor>csphere</vendor>
    <version>0.1</version>
    <published>2012-03-01</published>
    <copyright>cSphere Team</copyright>
    <license>Simplified BSD License</license>
    <name>Database</name>
    <info>Overview and tools for database content</info>
    <engine name="csphere" version_min="2013.0" />
    <icon type="famfamfam">gb</icon>
    <authors>
        <current>cSphere Team</current>
        <past>cSphere Team</past>
    </authors>
    <contact>
        <email adress="contact@csphere.eu" />
        <web url="http://www.csphere.eu" />
    </contact>
    <definitions>
        <define name="columns">Columns</define>
        <define name="data">Data</define>
        <define name="database">Database</define>
        <define name="deletes">Deletes</define>
        <define name="encoding">Encoding</define>
        <define name="foreigns">Foreigns</define>
        <define name="indexes">Indexes</define>
        <define name="inserts">Inserts</define>
        <define name="install_it">Installieren</define>
        <define name="install_ok">Tables and data created with success</define>
        <define name="no_data">No data found</define>
        <define name="no_table_found">No table found</define>
        <define name="primary">Primary</define>
        <define name="reload">Reload</define>
        <define name="schema">Schema</define>
        <define name="table">Table</define>
        <define name="table_name_error">Table name is not valid</define>
        <define name="tables">Tables</define>
        <define name="uninstall_it">Deinstallieren</define>
        <define name="uninstall_ok">Tables and options removed with success</define>
        <define name="uniques">Uniques</define>
        <define name="updates">Updates</define>
        <define name="version_client">Client version</define>
        <define name="version_driver">Driver version</define>
        <define name="version_server">Server version</define>
        <define name="where">Where</define>
    </definitions>
</language>